{
  "$schema": "../pool.schema.json",
  "poolName": "General AWS Services, Security & Serverless (Mixed Difficulty)",
  "description": "SAA-C03 revision questions on the AWS API, IAM and STS, federation, Service Catalog, GuardDuty, KMS, CloudHSM, ACM, Cognito, Directory Service, Secrets Manager, Lambda, Step Functions and selected AI/ML and application services at Easy, Medium and Hard difficulty.",
  "category": "General",
  "version": 1,
  "questions": [
    {
      "id": "cli-config-precedence",
      "prompt": "The AWS_DEFAULT_REGION environment variable is set to us-east-1 and the CLI config file sets the region to ap-southeast-2. A command is run with the option --region eu-west-1. Which Region does the command use?",
      "choices": [
        "us-east-1",
        "eu-west-1",
        "The command fails because the Region is defined in three places",
        "ap-southeast-2"
      ],
      "correctChoice": "eu-west-1",
      "explanation": "CLI command-line parameters take precedence over environment variables, which take precedence over the config files.",
      "difficulty": "Easy",
      "tags": [
        "AWS CLI",
        "Fundamentals"
      ]
    },
    {
      "id": "access-keys-two-active",
      "prompt": "An IAM user is allowed to have two active access keys at the same time. What is the main practical benefit?",
      "choices": [
        "One key can be limited to read-only access and the other to write access",
        "One key can be used for the console and the other key can be used with MFA devices",
        "Keys can be rotated with no downtime by moving applications to the new key first",
        "Two keys double the permissions that the user has in the account"
      ],
      "correctChoice": "Keys can be rotated with no downtime by moving applications to the new key first",
      "explanation": "Having two active keys lets you create a new key, update applications, and then disable and delete the old key. Both keys carry the same permissions as the user.",
      "difficulty": "Easy",
      "tags": [
        "IAM",
        "Access Keys"
      ]
    },
    {
      "id": "retry-exponential-backoff",
      "prompt": "An application intermittently receives network errors when calling an AWS API. Which retry strategy is the standard recommendation?",
      "choices": [
        "Retry with exponential backoff so the wait between attempts roughly doubles each time",
        "Retry every millisecond at a fixed interval to keep latency as low as possible",
        "Retry immediately in a tight loop until the call eventually succeeds",
        "Never retry and show the first error to the user straight away"
      ],
      "correctChoice": "Retry with exponential backoff so the wait between attempts roughly doubles each time",
      "explanation": "Exponential backoff reduces load on a struggling endpoint and gives transient network problems time to clear. SDKs and the CLI usually implement it by default.",
      "difficulty": "Easy",
      "tags": [
        "AWS API",
        "Resilience"
      ]
    },
    {
      "id": "sts-credential-components",
      "prompt": "An application receives temporary credentials from AWS STS. Which set of values does STS return?",
      "choices": [
        "A signed X.509 certificate and a private key",
        "Username, password and an MFA seed",
        "Access key ID and secret access key only, which never expire",
        "Access key ID, secret access key, session token and expiration"
      ],
      "correctChoice": "Access key ID, secret access key, session token and expiration",
      "explanation": "Temporary credentials include a session token and an expiration time in addition to an access key ID and secret access key. The session token must be supplied with requests.",
      "difficulty": "Easy",
      "tags": [
        "STS",
        "IAM"
      ]
    },
    {
      "id": "sts-regional-endpoint",
      "prompt": "An application in eu-west-1 calls the global STS endpoint (sts.amazonaws.com) and has seen increased latency. The team wants lower latency and less dependence on a single endpoint. What should they do?",
      "choices": [
        "Request a dedicated STS endpoint from AWS Support",
        "Configure the SDK to use the Regional STS endpoint",
        "Switch to long-term access keys to avoid STS calls",
        "Move the IAM users to the us-east-1 Region"
      ],
      "correctChoice": "Configure the SDK to use the Regional STS endpoint",
      "explanation": "Regional STS endpoints are recommended because they reduce latency and improve redundancy compared with the single global (legacy) endpoint. IAM users are global and are not moved between Regions.",
      "difficulty": "Medium",
      "tags": [
        "STS",
        "Performance"
      ]
    },
    {
      "id": "sigv4-what-is-sent",
      "prompt": "When a request is signed with Signature Version 4, what is sent to AWS with the request?",
      "choices": [
        "The secret access key in plain text, inside the Authorization header",
        "The secret access key, encrypted using the account's root user password",
        "A signature produced with a key derived from the secret key, not the secret key itself",
        "A hash of the IAM user's console password, compared against AWS's stored copy"
      ],
      "correctChoice": "A signature produced with a key derived from the secret key, not the secret key itself",
      "explanation": "Signature V4 builds a string to sign from request elements and creates a signature using HMAC with a signing key derived from the secret key. The secret access key is never transmitted, and the signature also protects the request from tampering.",
      "difficulty": "Medium",
      "tags": [
        "Signing",
        "Security"
      ]
    },
    {
      "id": "signing-anonymous-s3",
      "prompt": "The CLI and SDKs sign most AWS requests automatically. Which request would normally NOT need to be signed?",
      "choices": [
        "A call that creates a new IAM user inside the account",
        "A call that reads a stored secret from AWS Secrets Manager",
        "A call that launches a new EC2 instance in a private subnet",
        "An anonymous GET for an object in a publicly readable S3 bucket"
      ],
      "correctChoice": "An anonymous GET for an object in a publicly readable S3 bucket",
      "explanation": "Signing proves the requester's identity and prevents tampering, so it is not required for anonymous access to public S3 content. Authenticated API calls to other services must be signed.",
      "difficulty": "Easy",
      "tags": [
        "Signing",
        "S3"
      ]
    },
    {
      "id": "ip-ranges-allow-list",
      "prompt": "A company must allow only traffic from AWS services in specific Regions through its on-premises firewall, and the list must stay current as AWS adds addresses. What is the best approach?",
      "choices": [
        "Periodically download and parse the JSON file published at ip-ranges.amazonaws.com",
        "Request a fixed address list from AWS Support each year",
        "Open the firewall to all addresses used by the Regional endpoint's parent domain",
        "Resolve the service domain names once and hard-code the addresses"
      ],
      "correctChoice": "Periodically download and parse the JSON file published at ip-ranges.amazonaws.com",
      "explanation": "AWS publishes its IP ranges as JSON and updates them as ranges change, so automation can use the file to maintain allow lists. Hard-coded addresses become stale.",
      "difficulty": "Medium",
      "tags": [
        "IP Ranges",
        "Networking"
      ]
    },
    {
      "id": "iam-policy-type-editable",
      "prompt": "Which type of IAM policy can an administrator edit after it is created and attach to many users, groups or roles?",
      "choices": [
        "An inline policy attached to a single role, which can also be shared with other roles",
        "A service control policy attached to an IAM group",
        "A customer managed policy",
        "An AWS managed policy"
      ],
      "correctChoice": "A customer managed policy",
      "explanation": "Customer managed policies are created and editable by you and reusable. AWS managed policies cannot be edited, and inline policies are embedded in one identity and are not reusable.",
      "difficulty": "Easy",
      "tags": [
        "IAM",
        "Policies"
      ]
    },
    {
      "id": "iam-principal-element",
      "prompt": "In which type of policy does the Principal element appear?",
      "choices": [
        "Resource-based policies and role trust policies",
        "Permissions boundaries attached to users",
        "Only AWS managed policies",
        "Identity-based policies attached to users and groups"
      ],
      "correctChoice": "Resource-based policies and role trust policies",
      "explanation": "Principal specifies who the policy applies to, so it is used where the policy is attached to a resource or defines who may assume a role. In identity-based policies the principal is implicitly the attached identity.",
      "difficulty": "Easy",
      "tags": [
        "IAM",
        "Policies"
      ]
    },
    {
      "id": "iam-inline-vs-managed-reuse",
      "prompt": "The same set of S3 read permissions must be applied to five different roles, and a future change must apply to all of them at once. What is the best approach?",
      "choices": [
        "Add the permissions to the root user's policy",
        "Attach an AWS managed policy and edit it for this use",
        "Create an identical inline policy in each of the five roles",
        "Create one customer managed policy and attach it to all five roles"
      ],
      "correctChoice": "Create one customer managed policy and attach it to all five roles",